EXPERIMENT/IDENTIFIERS/PRIMARY_ID,EXPERIMENT/TITLE,EXPERIMENT/STUDY_REF/IDENTIFIERS/PRIMARY_ID,EXPERIMENT/STUDY_REF/_accession,EXPERIMENT/DESIGN/DESIGN_DESCRIPTION,EXPERIMENT/DESIGN/SAMPLE_DESCRIPTOR/IDENTIFIERS/PRIMARY_ID,EXPERIMENT/DESIGN/SAMPLE_DESCRIPTOR/_accession,EXPERIMENT/DESIGN/LIBRARY_DESCRIPTOR/LIBRARY_NAME,EXPERIMENT/DESIGN/LIBRARY_DESCRIPTOR/LIBRARY_STRATEGY,EXPERIMENT/DESIGN/LIBRARY_DESCRIPTOR/LIBRARY_SOURCE,EXPERIMENT/DESIGN/LIBRARY_DESCRIPTOR/LIBRARY_SELECTION,EXPERIMENT/DESIGN/LIBRARY_DESCRIPTOR/LIBRARY_LAYOUT/PAIRED/_NOMINAL_SDEV,EXPERIMENT/DESIGN/SPOT_DESCRIPTOR/SPOT_DECODE_SPEC/SPOT_LENGTH,EXPERIMENT/DESIGN/SPOT_DESCRIPTOR/SPOT_DECODE_SPEC/READ_SPEC/0/READ_INDEX,EXPERIMENT/DESIGN/SPOT_DESCRIPTOR/SPOT_DECODE_SPEC/READ_SPEC/0/READ_CLASS,EXPERIMENT/DESIGN/SPOT_DESCRIPTOR/SPOT_DECODE_SPEC/READ_SPEC/0/READ_TYPE,EXPERIMENT/DESIGN/SPOT_DESCRIPTOR/SPOT_DECODE_SPEC/READ_SPEC/0/BASE_COORD,EXPERIMENT/DESIGN/SPOT_DESCRIPTOR/SPOT_DECODE_SPEC/READ_SPEC/1/READ_INDEX,EXPERIMENT/DESIGN/SPOT_DESCRIPTOR/SPOT_DECODE_SPEC/READ_SPEC/1/READ_CLASS,EXPERIMENT/DESIGN/SPOT_DESCRIPTOR/SPOT_DECODE_SPEC/READ_SPEC/1/READ_TYPE,EXPERIMENT/DESIGN/SPOT_DESCRIPTOR/SPOT_DECODE_SPEC/READ_SPEC/1/BASE_COORD,EXPERIMENT/PLATFORM/ILLUMINA/INSTRUMENT_MODEL,EXPERIMENT/PROCESSING,EXPERIMENT/EXPERIMENT_LINKS/EXPERIMENT_LINK/XREF_LINK/DB,EXPERIMENT/EXPERIMENT_LINKS/EXPERIMENT_LINK/XREF_LINK/ID,EXPERIMENT/_alias,EXPERIMENT/_accession,EXPERIMENT/_center_name,SUBMISSION/IDENTIFIERS/PRIMARY_ID,SUBMISSION/_xmlns:xsi,SUBMISSION/_alias,SUBMISSION/_submission_comment,SUBMISSION/_center_name,SUBMISSION/_lab_name,SUBMISSION/_accession,Organization/Name/_abbr,Organization/Name/__text,Organization/_type,STUDY/IDENTIFIERS/PRIMARY_ID,STUDY/IDENTIFIERS/EXTERNAL_ID/_namespace,STUDY/IDENTIFIERS/EXTERNAL_ID/_label,STUDY/IDENTIFIERS/EXTERNAL_ID/__text,STUDY/DESCRIPTOR/STUDY_TITLE,STUDY/DESCRIPTOR/STUDY_TYPE/_existing_study_type,STUDY/DESCRIPTOR/STUDY_ABSTRACT,STUDY/DESCRIPTOR/CENTER_PROJECT_NAME,STUDY/_center_name,STUDY/_alias,STUDY/_accession,SAMPLE/IDENTIFIERS/PRIMARY_ID,SAMPLE/IDENTIFIERS/EXTERNAL_ID/_namespace,SAMPLE/IDENTIFIERS/EXTERNAL_ID/__text,SAMPLE/TITLE,SAMPLE/SAMPLE_NAME/TAXON_ID,SAMPLE/SAMPLE_NAME/SCIENTIFIC_NAME,SAMPLE/SAMPLE_ATTRIBUTES/SAMPLE_ATTRIBUTE/TAG,SAMPLE/SAMPLE_ATTRIBUTES/SAMPLE_ATTRIBUTE/VALUE,SAMPLE/_alias,SAMPLE/_accession,Pool/Member/IDENTIFIERS/PRIMARY_ID,Pool/Member/IDENTIFIERS/EXTERNAL_ID/_namespace,Pool/Member/IDENTIFIERS/EXTERNAL_ID/__text,Pool/Member/_member_name,Pool/Member/_accession,Pool/Member/_sample_name,Pool/Member/_sample_title,Pool/Member/_spots,Pool/Member/_bases,Pool/Member/_tax_id,Pool/Member/_organism,RUN_SET/RUN/IDENTIFIERS/PRIMARY_ID,RUN_SET/RUN/EXPERIMENT_REF/IDENTIFIERS/PRIMARY_ID,RUN_SET/RUN/EXPERIMENT_REF/_accession,RUN_SET/RUN/Pool/Member/IDENTIFIERS/PRIMARY_ID,RUN_SET/RUN/Pool/Member/IDENTIFIERS/EXTERNAL_ID/_namespace,RUN_SET/RUN/Pool/Member/IDENTIFIERS/EXTERNAL_ID/__text,RUN_SET/RUN/Pool/Member/_member_name,RUN_SET/RUN/Pool/Member/_accession,RUN_SET/RUN/Pool/Member/_sample_name,RUN_SET/RUN/Pool/Member/_sample_title,RUN_SET/RUN/Pool/Member/_spots,RUN_SET/RUN/Pool/Member/_bases,RUN_SET/RUN/Pool/Member/_tax_id,RUN_SET/RUN/Pool/Member/_organism,RUN_SET/RUN/SRAFiles/SRAFile/0/Alternatives/0/_url,RUN_SET/RUN/SRAFiles/SRAFile/0/Alternatives/0/_free_egress,RUN_SET/RUN/SRAFiles/SRAFile/0/Alternatives/0/_access_type,RUN_SET/RUN/SRAFiles/SRAFile/0/Alternatives/0/_org,RUN_SET/RUN/SRAFiles/SRAFile/0/Alternatives/1/_url,RUN_SET/RUN/SRAFiles/SRAFile/0/Alternatives/1/_free_egress,RUN_SET/RUN/SRAFiles/SRAFile/0/Alternatives/1/_access_type,RUN_SET/RUN/SRAFiles/SRAFile/0/Alternatives/1/_org,RUN_SET/RUN/SRAFiles/SRAFile/0/_cluster,RUN_SET/RUN/SRAFiles/SRAFile/0/_filename,RUN_SET/RUN/SRAFiles/SRAFile/0/_size,RUN_SET/RUN/SRAFiles/SRAFile/0/_date,RUN_SET/RUN/SRAFiles/SRAFile/0/_md5,RUN_SET/RUN/SRAFiles/SRAFile/0/_semantic_name,RUN_SET/RUN/SRAFiles/SRAFile/0/_supertype,RUN_SET/RUN/SRAFiles/SRAFile/0/_sratoolkit,RUN_SET/RUN/SRAFiles/SRAFile/1/Alternatives/0/_url,RUN_SET/RUN/SRAFiles/SRAFile/1/Alternatives/0/_free_egress,RUN_SET/RUN/SRAFiles/SRAFile/1/Alternatives/0/_access_type,RUN_SET/RUN/SRAFiles/SRAFile/1/Alternatives/0/_org,RUN_SET/RUN/SRAFiles/SRAFile/1/Alternatives/1/_url,RUN_SET/RUN/SRAFiles/SRAFile/1/Alternatives/1/_free_egress,RUN_SET/RUN/SRAFiles/SRAFile/1/Alternatives/1/_access_type,RUN_SET/RUN/SRAFiles/SRAFile/1/Alternatives/1/_org,RUN_SET/RUN/SRAFiles/SRAFile/1/_cluster,RUN_SET/RUN/SRAFiles/SRAFile/1/_filename,RUN_SET/RUN/SRAFiles/SRAFile/1/_size,RUN_SET/RUN/SRAFiles/SRAFile/1/_date,RUN_SET/RUN/SRAFiles/SRAFile/1/_md5,RUN_SET/RUN/SRAFiles/SRAFile/1/_semantic_name,RUN_SET/RUN/SRAFiles/SRAFile/1/_supertype,RUN_SET/RUN/SRAFiles/SRAFile/1/_sratoolkit,RUN_SET/RUN/SRAFiles/SRAFile/2/Alternatives/0/_url,RUN_SET/RUN/SRAFiles/SRAFile/2/Alternatives/0/_free_egress,RUN_SET/RUN/SRAFiles/SRAFile/2/Alternatives/0/_access_type,RUN_SET/RUN/SRAFiles/SRAFile/2/Alternatives/0/_org,RUN_SET/RUN/SRAFiles/SRAFile/2/Alternatives/1/_url,RUN_SET/RUN/SRAFiles/SRAFile/2/Alternatives/1/_free_egress,RUN_SET/RUN/SRAFiles/SRAFile/2/Alternatives/1/_access_type,RUN_SET/RUN/SRAFiles/SRAFile/2/Alternatives/1/_org,RUN_SET/RUN/SRAFiles/SRAFile/2/_cluster,RUN_SET/RUN/SRAFiles/SRAFile/2/_filename,RUN_SET/RUN/SRAFiles/SRAFile/2/_size,RUN_SET/RUN/SRAFiles/SRAFile/2/_date,RUN_SET/RUN/SRAFiles/SRAFile/2/_md5,RUN_SET/RUN/SRAFiles/SRAFile/2/_semantic_name,RUN_SET/RUN/SRAFiles/SRAFile/2/_supertype,RUN_SET/RUN/SRAFiles/SRAFile/2/_sratoolkit,RUN_SET/RUN/SRAFiles/SRAFile/3/Alternatives/0/_url,RUN_SET/RUN/SRAFiles/SRAFile/3/Alternatives/0/_free_egress,RUN_SET/RUN/SRAFiles/SRAFile/3/Alternatives/0/_access_type,RUN_SET/RUN/SRAFiles/SRAFile/3/Alternatives/0/_org,RUN_SET/RUN/SRAFiles/SRAFile/3/Alternatives/1/_url,RUN_SET/RUN/SRAFiles/SRAFile/3/Alternatives/1/_free_egress,RUN_SET/RUN/SRAFiles/SRAFile/3/Alternatives/1/_access_type,RUN_SET/RUN/SRAFiles/SRAFile/3/Alternatives/1/_org,RUN_SET/RUN/SRAFiles/SRAFile/3/_cluster,RUN_SET/RUN/SRAFiles/SRAFile/3/_filename,RUN_SET/RUN/SRAFiles/SRAFile/3/_size,RUN_SET/RUN/SRAFiles/SRAFile/3/_date,RUN_SET/RUN/SRAFiles/SRAFile/3/_md5,RUN_SET/RUN/SRAFiles/SRAFile/3/_semantic_name,RUN_SET/RUN/SRAFiles/SRAFile/3/_supertype,RUN_SET/RUN/SRAFiles/SRAFile/3/_sratoolkit,RUN_SET/RUN/SRAFiles/SRAFile/4/Alternatives/0/_url,RUN_SET/RUN/SRAFiles/SRAFile/4/Alternatives/0/_free_egress,RUN_SET/RUN/SRAFiles/SRAFile/4/Alternatives/0/_access_type,RUN_SET/RUN/SRAFiles/SRAFile/4/Alternatives/0/_org,RUN_SET/RUN/SRAFiles/SRAFile/4/_cluster,RUN_SET/RUN/SRAFiles/SRAFile/4/_filename,RUN_SET/RUN/SRAFiles/SRAFile/4/_url,RUN_SET/RUN/SRAFiles/SRAFile/4/_size,RUN_SET/RUN/SRAFiles/SRAFile/4/_date,RUN_SET/RUN/SRAFiles/SRAFile/4/_semantic_name,RUN_SET/RUN/SRAFiles/SRAFile/4/_supertype,RUN_SET/RUN/SRAFiles/SRAFile/4/_sratoolkit,RUN_SET/RUN/CloudFiles/CloudFile/0/_filetype,RUN_SET/RUN/CloudFiles/CloudFile/0/_provider,RUN_SET/RUN/CloudFiles/CloudFile/0/_location,RUN_SET/RUN/CloudFiles/CloudFile/1/_filetype,RUN_SET/RUN/CloudFiles/CloudFile/1/_provider,RUN_SET/RUN/CloudFiles/CloudFile/1/_location,RUN_SET/RUN/Statistics/Read/0/_index,RUN_SET/RUN/Statistics/Read/0/_count,RUN_SET/RUN/Statistics/Read/0/_average,RUN_SET/RUN/Statistics/Read/0/_stdev,RUN_SET/RUN/Statistics/Read/1/_index,RUN_SET/RUN/Statistics/Read/1/_count,RUN_SET/RUN/Statistics/Read/1/_average,RUN_SET/RUN/Statistics/Read/1/_stdev,RUN_SET/RUN/Statistics/_nreads,RUN_SET/RUN/Statistics/_nspots,RUN_SET/RUN/Bases/Base/0/_value,RUN_SET/RUN/Bases/Base/0/_count,RUN_SET/RUN/Bases/Base/1/_value,RUN_SET/RUN/Bases/Base/1/_count,RUN_SET/RUN/Bases/Base/2/_value,RUN_SET/RUN/Bases/Base/2/_count,RUN_SET/RUN/Bases/Base/3/_value,RUN_SET/RUN/Bases/Base/3/_count,RUN_SET/RUN/Bases/Base/4/_value,RUN_SET/RUN/Bases/Base/4/_count,RUN_SET/RUN/Bases/_cs_native,RUN_SET/RUN/Bases/_count,RUN_SET/RUN/_xmlns,RUN_SET/RUN/_xmlns:xsi,RUN_SET/RUN/_alias,RUN_SET/RUN/_center_name,RUN_SET/RUN/_accession,RUN_SET/RUN/_total_spots,RUN_SET/RUN/_total_bases,RUN_SET/RUN/_size,RUN_SET/RUN/_load_done,RUN_SET/RUN/_published,RUN_SET/RUN/_is_public,RUN_SET/RUN/_cluster_name,RUN_SET/RUN/_static_data_available,EXPERIMENT/_xmlns,RUN_SET/RUN/SRAFiles/SRAFile/2/Alternatives/2/_url,RUN_SET/RUN/SRAFiles/SRAFile/2/Alternatives/2/_free_egress,RUN_SET/RUN/SRAFiles/SRAFile/2/Alternatives/2/_access_type,RUN_SET/RUN/SRAFiles/SRAFile/2/Alternatives/2/_org,RUN_SET/RUN/SRAFiles/SRAFile/2/_url,RUN_SET/RUN/CloudFiles/CloudFile/2/_filetype,RUN_SET/RUN/CloudFiles/CloudFile/2/_provider,RUN_SET/RUN/CloudFiles/CloudFile/2/_location,RUN_SET/RUN/CloudFiles/CloudFile/3/_filetype,RUN_SET/RUN/CloudFiles/CloudFile/3/_provider,RUN_SET/RUN/CloudFiles/CloudFile/3/_location,RUN_SET/RUN/CloudFiles/CloudFile/4/_filetype,RUN_SET/RUN/CloudFiles/CloudFile/4/_provider,RUN_SET/RUN/CloudFiles/CloudFile/4/_location,RUN_SET/RUN/SRAFiles/SRAFile/4/Alternatives/1/_url,RUN_SET/RUN/SRAFiles/SRAFile/4/Alternatives/1/_free_egress,RUN_SET/RUN/SRAFiles/SRAFile/4/Alternatives/1/_access_type,RUN_SET/RUN/SRAFiles/SRAFile/4/Alternatives/1/_org,RUN_SET/RUN/SRAFiles/SRAFile/4/Alternatives/2/_url,RUN_SET/RUN/SRAFiles/SRAFile/4/Alternatives/2/_free_egress,RUN_SET/RUN/SRAFiles/SRAFile/4/Alternatives/2/_access_type,RUN_SET/RUN/SRAFiles/SRAFile/4/Alternatives/2/_org,RUN_SET/RUN/SRAFiles/SRAFile/4/_md5
SRX342618,Pooled Sequences of population Aha_31 (A. halleri),SRP029378,SRP029378,Pool-Seq approach: DNA of 20 individuals was extracted separately and pooled with equimolar concentration prior to sequencing,SRS475365,SRS475365,Aha_31,WGS,GENOMIC,RANDOM,0.0E0,202,0,Application Read,Forward,1,1,Application Read,Reverse,102,Illumina HiSeq 2000,,pubmed,24102711,Aha_31,SRX342618,ETH Z*rich,SRA098194,http://www.w3.org/2001/XMLSchema-instance,Pool-Seq A. halleri,5 population pools Illumina raw reads,ETH Z*rich,PEG,SRA098194,ETH Z*rich,ETH Z*rich,center,SRP029378,BioProject,primary,PRJNA217703,Arabidopsis halleri subsp. halleri strain:Wild plants Genome sequencing,Other,"We examined genome-wide patterns of nucleotide variation in natural populations of the outcrossing herb Arabidopsis halleri and associations with climatic variation among populations in the Alps. Using a pooled population sequencing (Pool-Seq) approach, we discovered more than two million SNPs in five natural populations and identified highly differentiated genomic regions and SNPs using FST–based analyses. We tested only the most strongly differentiated SNPs for associations with a non-redundant set of environmental factors using partial Mantel tests to identify topo-climatic factors that may underlie the observed footprints of selection.",Arabidopsis halleri subsp. halleri strain:Wild plants,BioProject,PRJNA217703,SRP029378,SRS475365,BioSample,SAMN02339783,Generic sample from Arabidopsis halleri,81970,Arabidopsis halleri,geo_loc_name,Switzerland: Castasegna,Aha31,SRS475365,SRS475365,BioSample,SAMN02339783,,SRS475365,Aha31,Generic sample from Arabidopsis halleri,144046920,29097477840,81970,Arabidopsis halleri,SRR964274,SRX342618,SRX342618,SRS475365,BioSample,SAMN02339783,,SRS475365,Aha31,Generic sample from Arabidopsis halleri,144046920,29097477840,81970,Arabidopsis halleri,gs://sra-pub-src-11/SRR964274/NG-5659_Aha_31_L2_read_1.fastq.bz2,-,Use Cloud Data Delivery,GCP,s3://sra-pub-src-11/SRR964274/NG-5659_Aha_31_L2_read_1.fastq.bz2,-,Use Cloud Data Delivery,AWS,public,NG-5659_Aha_31_L2_read_1.fastq.bz2,7518287217,2020-05-24 01:42:39,91d368f89459f1bfa88e142e55157f66,fastq,Original,0,gs://sra-pub-src-12/SRR964274/NG-5659_Aha_31_L2_read_2.fastq.bz2,-,Use Cloud Data Delivery,GCP,s3://sra-pub-src-12/SRR964274/NG-5659_Aha_31_L2_read_2.fastq.bz2,-,Use Cloud Data Delivery,AWS,public,NG-5659_Aha_31_L2_read_2.fastq.bz2,7673728527,2020-05-23 20:34:30,def109c99317b433bf06395c26ddbf16,fastq,Original,0,gs://sra-pub-src-13/SRR964274/NG-5659_Aha_31_L7_read_1.fastq.bz2,-,Use Cloud Data Delivery,GCP,s3://sra-pub-src-13/SRR964274/NG-5659_Aha_31_L7_read_1.fastq.bz2,-,Use Cloud Data Delivery,AWS,public,NG-5659_Aha_31_L7_read_1.fastq.bz2,2511961129,2020-05-24 01:21:16,6e249e76bceb35efe8ad8832fe577594,fastq,Original,0,gs://sra-pub-src-13/SRR964274/NG-5659_Aha_31_L7_read_2.fastq.bz2,-,Use Cloud Data Delivery,GCP,s3://sra-pub-src-13/SRR964274/NG-5659_Aha_31_L7_read_2.fastq.bz2,-,Use Cloud Data Delivery,AWS,public,NG-5659_Aha_31_L7_read_2.fastq.bz2,2565331232,2020-05-24 04:18:35,aa36201ae73db3371b69bf5ce25b76e1,fastq,Original,0,https://sra-downloadb.be-md.ncbi.nlm.nih.gov/sos1/sra-pub-run-1/SRR964274/SRR964274.1,worldwide,anonymous,NCBI,public,SRR964274,https://sra-downloadb.st-va.ncbi.nlm.nih.gov/sos2/sra-pub-run-3/SRR964274/SRR964274.1,20269355894,2013-09-04 18:12:21,run,Primary ETL,1,fastq,gs,gs.US,fastq,s3,s3.us-east-1,0,144046920,101,0,1,144046920,101,0,2,144046920,A,9184610165,C,5329873077,G,5412876925,T,9126138489,N,43979184,false,29097477840,,http://www.w3.org/2001/XMLSchema-instance,Aha_31,ETH Z*rich,SRR964274,144046920,29097477840,20269354148,true,2013-10-17 11:30:17,true,public,1,,,,,,,,,,,,,,,,,,,,,,,,
SRX342617,Pooled Sequences of population Aha_21 (A. halleri),SRP029378,SRP029378,Pool-Seq approach: DNA of 20 individuals was extracted separately and pooled with equimolar concentration prior to sequencing,SRS475364,SRS475364,Aha_21,WGS,GENOMIC,RANDOM,0.0E0,202,0,Application Read,Forward,1,1,Application Read,Reverse,102,Illumina HiSeq 2000,,pubmed,24102711,Aha_21,SRX342617,ETH Z*rich,SRA098194,http://www.w3.org/2001/XMLSchema-instance,Pool-Seq A. halleri,5 population pools Illumina raw reads,ETH Z*rich,PEG,SRA098194,ETH Z*rich,ETH Z*rich,center,SRP029378,BioProject,primary,PRJNA217703,Arabidopsis halleri subsp. halleri strain:Wild plants Genome sequencing,Other,"We examined genome-wide patterns of nucleotide variation in natural populations of the outcrossing herb Arabidopsis halleri and associations with climatic variation among populations in the Alps. Using a pooled population sequencing (Pool-Seq) approach, we discovered more than two million SNPs in five natural populations and identified highly differentiated genomic regions and SNPs using FST–based analyses. We tested only the most strongly differentiated SNPs for associations with a non-redundant set of environmental factors using partial Mantel tests to identify topo-climatic factors that may underlie the observed footprints of selection.",Arabidopsis halleri subsp. halleri strain:Wild plants,BioProject,PRJNA217703,SRP029378,SRS475364,BioSample,SAMN02339782,Generic sample from Arabidopsis halleri,81970,Arabidopsis halleri,geo_loc_name,Switzerland: Vicosoprano 2,Aha21,SRS475364,SRS475364,BioSample,SAMN02339782,,SRS475364,Aha21,Generic sample from Arabidopsis halleri,105004962,21211002324,81970,Arabidopsis halleri,SRR960965,SRX342617,SRX342617,SRS475364,BioSample,SAMN02339782,,SRS475364,Aha21,Generic sample from Arabidopsis halleri,105004962,21211002324,81970,Arabidopsis halleri,gs://sra-pub-src-13/SRR960965/NG-5959-A_Aha_21_lib9562_1_sequence_lane4.fastq.bz2,-,Use Cloud Data Delivery,GCP,s3://sra-pub-src-13/SRR960965/NG-5959-A_Aha_21_lib9562_1_sequence_lane4.fastq.bz2,-,Use Cloud Data Delivery,AWS,public,NG-5959-A_Aha_21_lib9562_1_sequence_lane4.fastq.bz2,6782976009,2020-05-24 10:53:54,e5dcf72ed811cb3e3fe8590c471becf2,fastq,Original,0,gs://sra-pub-src-10/SRR960965/NG-5959-A_Aha_21_lib9562_2_sequence_lane4.fastq.bz2,-,Use Cloud Data Delivery,GCP,s3://sra-pub-src-10/SRR960965/NG-5959-A_Aha_21_lib9562_2_sequence_lane4.fastq.bz2,-,Use Cloud Data Delivery,AWS,public,NG-5959-A_Aha_21_lib9562_2_sequence_lane4.fastq.bz2,6886580413,2020-05-24 10:55:30,36a9b1f2dd39c6476e563bf749b68c5f,fastq,Original,0,gs://sra-pub-crun-6/SRR960965/SRR960965.1,-,Use Cloud Data Delivery,GCP,https://sra-pub-run-odp.s3.amazonaws.com/sra/SRR960965/SRR960965,worldwide,anonymous,AWS,public,SRR960965,13751889111,2013-09-03 17:07:15,accf5e906ae973f899393c5032e0ec2b,run,Primary ETL,1,,,,,,,,,,,,,,,,,,,,,,,,,,,,,fastq,gs,gs.US,fastq,s3,s3.us-east-1,0,105004962,101,0,1,105004962,101,0,2,105004962,A,6307185134,C,4293943871,G,4307808937,T,6286479651,N,15584731,false,21211002324,,http://www.w3.org/2001/XMLSchema-instance,Aha_21,ETH Z*rich,SRR960965,105004962,21211002324,13751887364,true,2013-10-17 11:30:17,true,public,1,,https://sra-downloadb.be-md.ncbi.nlm.nih.gov/sos1/sra-pub-run-5/SRR960965/SRR960965.1,worldwide,anonymous,NCBI,https://sra-downloadb.st-va.ncbi.nlm.nih.gov/sos2/sra-pub-run-6/SRR960965/SRR960965.1,run,gs,gs.US,run,s3,s3.us-east-1,run.zq,gs,gs.US,,,,,,,,,
SRX342616,Pooled Sequences of population Aha_09 (A. halleri),SRP029378,SRP029378,Pool-Seq approach: DNA of 20 individuals was extracted separately and pooled with equimolar concentration prior to sequencing,SRS474962,SRS474962,Aha_09,WGS,GENOMIC,RANDOM,0.0E0,202,0,Application Read,Forward,1,1,Application Read,Reverse,102,Illumina HiSeq 2000,,pubmed,24102711,Aha_09,SRX342616,ETH Z*rich,SRA098194,http://www.w3.org/2001/XMLSchema-instance,Pool-Seq A. halleri,5 population pools Illumina raw reads,ETH Z*rich,PEG,SRA098194,ETH Z*rich,ETH Z*rich,center,SRP029378,BioProject,primary,PRJNA217703,Arabidopsis halleri subsp. halleri strain:Wild plants Genome sequencing,Other,"We examined genome-wide patterns of nucleotide variation in natural populations of the outcrossing herb Arabidopsis halleri and associations with climatic variation among populations in the Alps. Using a pooled population sequencing (Pool-Seq) approach, we discovered more than two million SNPs in five natural populations and identified highly differentiated genomic regions and SNPs using FST–based analyses. We tested only the most strongly differentiated SNPs for associations with a non-redundant set of environmental factors using partial Mantel tests to identify topo-climatic factors that may underlie the observed footprints of selection.",Arabidopsis halleri subsp. halleri strain:Wild plants,BioProject,PRJNA217703,SRP029378,SRS474962,BioSample,SAMN02339779,Generic sample from Arabidopsis halleri,81970,Arabidopsis halleri,geo_loc_name,Switzerland: Vicosoprano 1,Aha09,SRS474962,SRS474962,BioSample,SAMN02339779,,SRS474962,Aha09,Generic sample from Arabidopsis halleri,123725669,24992585138,81970,Arabidopsis halleri,SRR964271,SRX342616,SRX342616,SRS474962,BioSample,SAMN02339779,,SRS474962,Aha09,Generic sample from Arabidopsis halleri,123725669,24992585138,81970,Arabidopsis halleri,gs://sra-pub-src-10/SRR964271/NG-5659_Aha_09_L2_read_1.fastq.bz2,-,Use Cloud Data Delivery,GCP,s3://sra-pub-src-10/SRR964271/NG-5659_Aha_09_L2_read_1.fastq.bz2,-,Use Cloud Data Delivery,AWS,public,NG-5659_Aha_09_L2_read_1.fastq.bz2,6474494461,2020-05-24 12:37:15,e160659c8772110ca00dc9f37f553ea2,fastq,Original,0,gs://sra-pub-src-11/SRR964271/NG-5659_Aha_09_L2_read_2.fastq.bz2,-,Use Cloud Data Delivery,GCP,s3://sra-pub-src-11/SRR964271/NG-5659_Aha_09_L2_read_2.fastq.bz2,-,Use Cloud Data Delivery,AWS,public,NG-5659_Aha_09_L2_read_2.fastq.bz2,6664959378,2020-05-24 12:37:08,908485d011ecfd9d23f1b0bbd377651c,fastq,Original,0,gs://sra-pub-src-11/SRR964271/NG-5659_Aha_09_L7_read_1.fastq.bz2,-,Use Cloud Data Delivery,GCP,s3://sra-pub-src-11/SRR964271/NG-5659_Aha_09_L7_read_1.fastq.bz2,-,Use Cloud Data Delivery,AWS,public,NG-5659_Aha_09_L7_read_1.fastq.bz2,2191656431,2020-05-23 09:48:36,2b4e791186f39b536e5c0ca05491c0f7,fastq,Original,0,gs://sra-pub-src-9/SRR964271/NG-5659_Aha_09_L7_read_2.fastq.bz2,-,Use Cloud Data Delivery,GCP,s3://sra-pub-src-9/SRR964271/NG-5659_Aha_09_L7_read_2.fastq.bz2,-,Use Cloud Data Delivery,AWS,public,NG-5659_Aha_09_L7_read_2.fastq.bz2,2251682952,2020-05-24 09:45:50,8e87c32b7264d5c93e0b82616ca88d8d,fastq,Original,0,gs://sra-pub-crun-1/SRR964271/SRR964271.1,-,Use Cloud Data Delivery,GCP,public,SRR964271,https://sra-downloadb.st-va.ncbi.nlm.nih.gov/sos2/sra-pub-run-3/SRR964271/SRR964271.1,17573590341,2013-09-05 05:57:45,run,Primary ETL,1,fastq,gs,gs.US,fastq,s3,s3.us-east-1,0,123725669,101,0,1,123725669,101,0,2,123725669,A,7864544379,C,4596708585,G,4639609780,T,7854245533,N,37476861,false,24992585138,,http://www.w3.org/2001/XMLSchema-instance,Aha_09,ETH Z*rich,SRR964271,123725669,24992585138,17573588589,true,2013-10-17 11:30:17,true,public,1,,,,,,,run,gs,gs.US,run,s3,s3.us-east-1,run.zq,gs,gs.US,https://sra-pub-run-odp.s3.amazonaws.com/sra/SRR964271/SRR964271,worldwide,anonymous,AWS,https://sra-downloadb.be-md.ncbi.nlm.nih.gov/sos1/sra-pub-run-1/SRR964271/SRR964271.1,worldwide,anonymous,NCBI,3325f6fcab9debca5a2a4913fe06005b
SRX342614,Pooled Sequences of population Aha_19 (A. halleri),SRP029378,SRP029378,Pool-Seq approach: DNA of 20 individuals was extracted separately and pooled with equimolar concentration prior to sequencing,SRS475362,SRS475362,Aha_19,WGS,GENOMIC,RANDOM,0.0E0,202,0,Application Read,Forward,1,1,Application Read,Reverse,102,Illumina HiSeq 2000,,pubmed,24102711,Aha_19,SRX342614,ETH Z*rich,SRA098194,http://www.w3.org/2001/XMLSchema-instance,Pool-Seq A. halleri,5 population pools Illumina raw reads,ETH Z*rich,PEG,SRA098194,ETH Z*rich,ETH Z*rich,center,SRP029378,BioProject,primary,PRJNA217703,Arabidopsis halleri subsp. halleri strain:Wild plants Genome sequencing,Other,"We examined genome-wide patterns of nucleotide variation in natural populations of the outcrossing herb Arabidopsis halleri and associations with climatic variation among populations in the Alps. Using a pooled population sequencing (Pool-Seq) approach, we discovered more than two million SNPs in five natural populations and identified highly differentiated genomic regions and SNPs using FST–based analyses. We tested only the most strongly differentiated SNPs for associations with a non-redundant set of environmental factors using partial Mantel tests to identify topo-climatic factors that may underlie the observed footprints of selection.",Arabidopsis halleri subsp. halleri strain:Wild plants,BioProject,PRJNA217703,SRP029378,SRS475362,BioSample,SAMN02339781,Generic sample from Arabidopsis halleri,81970,Arabidopsis halleri,geo_loc_name,Switzerland: Poschiavo,Aha19,SRS475362,SRS475362,BioSample,SAMN02339781,,SRS475362,Aha19,Generic sample from Arabidopsis halleri,125881832,25428130064,81970,Arabidopsis halleri,SRR964273,SRX342614,SRX342614,SRS475362,BioSample,SAMN02339781,,SRS475362,Aha19,Generic sample from Arabidopsis halleri,125881832,25428130064,81970,Arabidopsis halleri,gs://sra-pub-src-14/SRR964273/NG-5659_Aha_19_L6_read_1.fastq.bz2,-,Use Cloud Data Delivery,GCP,s3://sra-pub-src-14/SRR964273/NG-5659_Aha_19_L6_read_1.fastq.bz2,-,Use Cloud Data Delivery,AWS,public,NG-5659_Aha_19_L6_read_1.fastq.bz2,6315573377,2020-05-24 11:32:41,c64048dc024a59fa6794cf381ecf9ec7,fastq,Original,0,gs://sra-pub-src-9/SRR964273/NG-5659_Aha_19_L6_read_2.fastq.bz2,-,Use Cloud Data Delivery,GCP,s3://sra-pub-src-9/SRR964273/NG-5659_Aha_19_L6_read_2.fastq.bz2,-,Use Cloud Data Delivery,AWS,public,NG-5659_Aha_19_L6_read_2.fastq.bz2,6497933591,2020-05-24 11:43:44,0c5542c4a9e7d2d020d404b917b17a0d,fastq,Original,0,gs://sra-pub-src-10/SRR964273/NG-5659_Aha_19_L7_read_1.fastq.bz2,-,Use Cloud Data Delivery,GCP,s3://sra-pub-src-10/SRR964273/NG-5659_Aha_19_L7_read_1.fastq.bz2,-,Use Cloud Data Delivery,AWS,public,NG-5659_Aha_19_L7_read_1.fastq.bz2,2546129617,2020-05-24 11:36:56,d0887d6bc4c2a640598631af022b8132,fastq,Original,0,gs://sra-pub-src-11/SRR964273/NG-5659_Aha_19_L7_read_2.fastq.bz2,-,Use Cloud Data Delivery,GCP,s3://sra-pub-src-11/SRR964273/NG-5659_Aha_19_L7_read_2.fastq.bz2,-,Use Cloud Data Delivery,AWS,public,NG-5659_Aha_19_L7_read_2.fastq.bz2,2607245360,2020-05-24 01:31:30,f4fd443d2fc5022b6bf0466f8514ff5b,fastq,Original,0,gs://sra-pub-crun-1/SRR964273/SRR964273.1,-,Use Cloud Data Delivery,GCP,public,SRR964273,https://sra-downloadb.st-va.ncbi.nlm.nih.gov/sos2/sra-pub-run-3/SRR964273/SRR964273.1,17948931384,2013-09-04 18:22:43,run,Primary ETL,1,fastq,gs,gs.US,fastq,s3,s3.us-east-1,0,125881832,101,0,1,125881832,101,0,2,125881832,A,7983648469,C,4692765107,G,4727250068,T,7978575107,N,45891313,false,25428130064,,http://www.w3.org/2001/XMLSchema-instance,Aha_19,ETH Z*rich,SRR964273,125881832,25428130064,17948929638,true,2013-10-17 11:30:17,true,public,1,,,,,,,run,gs,gs.US,run,s3,s3.us-east-1,run.zq,gs,gs.US,https://sra-pub-run-odp.s3.amazonaws.com/sra/SRR964273/SRR964273,worldwide,anonymous,AWS,https://sra-downloadb.be-md.ncbi.nlm.nih.gov/sos1/sra-pub-run-1/SRR964273/SRR964273.1,worldwide,anonymous,NCBI,84efc48666bc386a0bd30b2d6dc1d716
